author|flightDate|flightFromCity|flightToCity|flightType|flightClass|mark|title|text
Pablopadano|dicembre 2018|Milano|Abu Dhabi|Internazionali|Economy|2.0|Viaggiare peggio di una low cost ad un prezzo da compagnia di bandiera!|Ho viaggiato a Dicembre da Milano ad Abudhabi , e mi aspettavo decisamente di meglio. Posti in Economy davvero molto stretti , peggio di una low cost ( e non sono un gigante) , proposte di cibo e bevande a bordo davvero scarso sia in quantità che in qualità, aereo gelido ( sembrava di volare su una compagnia americana). Il personale gentile ( nella norma). L'unica nota positiva il viaggio tutto bene , superpuntuale.
blondieatttitude|dicembre 2018|Milano|Abu Dhabi|Internazionali|Economy|3.0|Mi aspettavo molto meglio|Per essere una delle migliori compagnie, mi aspettavo decisamente di meglio. Posti in Economy davvero molto stretti (pseudo Ryanair) e con proposte di cibo e bevande a bordo davvero scarso sia in quantità che in qualità. Personale non spicca per estrema gentilezza. L'unica nota positiva il viaggio tutto bene (senza turbolenze) e buono l'intrattenimento a bordo con vari film tra gli ultimi usciti e buona scelta di musica. Attenzione a prenotare un volo Etihad da Alitalia perchè non si può fare il check in online (ma solo la preassegnazione dei posti)
🚜 🐎🏂🌊|dicembre 2018|Abu Dhabi|Jakarta|Internazionali|Business|5.0|At the end is The Best|La crisi ha toccato tutte le compagnie, Etihad non e' piu quella di circa 6/7 anni fa ma comunque e' sempre la migliore per il servizio e facility che offre.  dal chk inn, la lounge e' sempre super attrezzata e lo staff estremamente professionale.  Esperienza business eccezionale. volato con A380, mentre il ritorno in economy ottima, sopra i standards
diegozucchelli|dicembre 2018|Abu Dhabi|Roma|Internazionali|Economy|4.0|Viaggio di ritorno da Abu Dhabi dopo una crociera con la Costa.|<siamo stati in grado di fare il check-in direttamente al terminale del porto di Abu Dhabi, per un accordo della compagnia Costa evitando la coda all'aereoporto, puntualità svizzera, aero sufficientemente confortevole, servizio curato sia in partenza che durante il viaggio, collegamento diretto con altro biglietto da Roma a Verona con Alitalia, compagnia collegata
Gabryen|dicembre 2018|Milano|Singapore|Internazionali|Economy|2.0|Inizio pessimo|Già dalla scelta dei posti, scopro che non si possono fare se non pagando profumatamente ogni tratta e se non si paga nulla, vengono di proposito assegnati posti molto lontani fra loro. Peccato che uno dei viaggiatori sia un bambino e pertanto non possa certo passare 12 ore di volo da solo, lontano dai genitori. Trovo inaccettabile che una linea aerea così quotata si attacchi a qualche decina di euro di surplus sui biglietti, visto che già non sono regalati. Mi aspettavo un servizio ben diverso.
Ombretta Z|dicembre 2018|Milano|Abu Dhabi|Internazionali|Economy|3.0|Puntualità. Servizio sufficiente.|E' la prima volta che volo con Etihad: sinceramente pensavo un po' meglio nella totalità dei servizi. La puntualità è stata ineccepibile. I servizi in volo sufficienti. Richiesto menu veg: ricevuto senza problemi. L'aeromobile non molto spazioso (in special modo per spazio gambe) in classe Economy. Pulizia buona.
Michael G|dicembre 2018|Roma|Abu Dhabi|Internazionali|Economy|2.0|mi aspettavo di più|aereo non pulito alla partenza da Roma; al ritorno pulizia accettabile; il personale di bordo gentile; il cibo offerto di scarsa qualità
paolo p|novembre 2018|Roma|Ahmedabad|Internazionali|Economy|3.0|PENSAVO MEGLIO|ho scelto questo vettore per gli orari e per il prezzo. Alla resa dei conti l'aereomobile dell'andata era secondo me vecchio rispetto a quello del ritorno che mi è sembrato più curato e moderno. Il volo è stato puntuale nel rispetto degli orari previsti. Assolutamente da migliorare i servizi a bordo. Posti scelti con un incremento del prezzo abbastanza confortevoli.
Elisabetta C|dicembre 2018|Roma|Bangkok|Internazionali|Economy|4.0|Puntualità e buon servizio|Volo con viaggio organizzato in Tailandia. Personale gentile sia al check-in che sull' aereo. Posti discretamente comodi fino ad Abu Dhabi poi nella tratta Abu Dhabi- Bangkok più scomodi e stretti! Cibo abbastanza buono, con posate di metallo. Pulizia buona nell' aereo. Schermo personale in ogni posto con buona scelta di film e intrattenimento. Gli orari di volo sono stati rispettati. Nel complesso buona esperienza!
bastiglia|dicembre 2018|Milano|Malé|Internazionali|Economy|4.0|...prima volta con Etihad|Decisamente superiore ai voli charter,aereo moderno e ben curato,l'unico neo è stato il cibo,un pò speziato...
cris731|agosto 2018|Roma|Abu Dhabi|Internazionali|Economy|1.0|pessimo|volo pessimo sotto tutti gli aspetti. diciamo solo che per volare in certe aree del pianeta c'è la possibilità di scegliere altro.
Virgilio01|NULL|Milano|Melbourne|Internazionali|Economy|4.0|Visita a figli|Il viaggio come è noto si è ridotto di uno scalo. Con Etihad: malpensa - scalo abu Dhabi e melbourne. L'alimentazione in volo è ridotta a meno della sussistenza. La tratta più pesante è abu dhabi - Melbourne. Unica tratta da 13 ore circa. Che dire. Dal jet lag per recuperare sono necessari un Po di giorni. Il fuso orario fa andare AVANTI le lancette di 10 ore. Melbourne una città multietnica molto bella. Che dire: Buon viaggio. Comunque per me che sono italiano, l'italia è l'italia
Massimo B|dicembre 2018|Milano|Colombo|Internazionali|Economy|2.0|Puntuali ma quanta scomodità|Ho fatto due tratte con Etihad: da Roma a Abu Dhabi e da qui a Colombo. Posto Evonomy con poco spazio sedili scomodissimi, servizio ridotto all’essenziale e di scarsa qualità
Martina|marzo 2018|Milano|Kochi (Cochin)|Internazionali|Business|5.0|Così viaggiare è un piacere|Consiglio a tutti Etihad come compagnia aerea è veramente super Accogliente il personale, aerei puntuali, cortesia al check in e cortesia a bordo Ho viaggiato con loro sia in economy e comunque mi sono trovata molto bene che in business, e qui è stato un volo fantastico! Comode poltrone letto, privacy, pasti e ogni richiesta totalmente soddisfatta.
Sandro I|settembre 2018|Roma|Sydney|Internazionali|Economy|5.0|Volo straordinario|Ho volato con Etihad consiglio a tutti questa compagnia, servizi davvero di alta classe nonostante abbia volato con economy class.
Giacomo Pedone|NULL|Roma|Bangkok|Internazionali|Economy|4.0|Molto bene|Ci siamo trovati bene, le hostess molto gentili, aerei di linea più o meno tutti nuovi. Pur essendo stato nella classe economy sono riuscito a riposarmi abbastanza.consiglio assolutamente questa compagnia.
MANUELA|agosto 2018|Milano|Victoria|Internazionali|Economy|1.0|MI HANNO FATTO PERDERE LA COINCIDENZA PER IL VOLO SUCCESSIVO E NESSUNA ASSISTENZA NE RIMBORSO DANNI|Essendo il volo arrivato in ritardo abbiamo perso la coincidenza del terzo volo (pacchetto di tre voli acquistato da loro) siamo rimasti un giorno e mezzo in aeroporto senza nessuna assistenza (viaggiavo con bambino) senza avermi rimborsato nessuna spesa sostenuta in aeroporto ne rimborsarmi le spesa dell'hotel da me prenotato per le vacanze e non fruito in quanto bloccata in aeroporto
Pierluca|gennaio 2018|Roma|Brisbane|Internazionali|Economy|5.0|Il meglio sul mercato|L’esperienza di volo migliore che abbia mai provato. Personale qualificato, aerei nuovi, intrattenimento di ultima generazione, cibo buono... Consiglierei Etihad senza indugi!
Silvano Martinotti|novembre 2018|Abu Dhabi|Milano|Internazionali|Economy|3.0|Mi aspettavo molto di più.|Ho sempre viaggiato con Emirates che trovo essere la migliore compagnia. Tuttavia non avendo mai viaggiato con Etihad ed avendo sempre sentito parlare molto bene della stessa, mi attendevo un servizio sopra ogni aspetto, invece una delusione totale, ad iniziare proprio dall'aeroporto di Abu Dhabi. Non esiste un particolare preciso, ma i sedili erano molto vicini l'uno all'altro, intrattenimento tv di bassa qualità, personale che devi sempre sollecitare con chiamata. In generale una Compagnia non all'altezza dell'immagine che è stata profusa. Se non per necessità, volo diretto ad Abu Dhabi, non la userò più.
