author|flightDate|flightFromCity|flightToCity|flightType|flightClass|mark|title|text
the Tuarregh life|agosto 2019|Milano|Colombo|Internazionali|Economy|4.0|GRANDE COMPAGNIA CON QUALCHE MA DA SISTEMARE|Abbiamo preso in totale 5 voli da e per le nostre vacanze. Prezzi buoni, aeromobili abbastanza nuovi (anche se la scelta dei tessuti interni è un pò vintage con questo beige/marrone e derivati) e personale solitamente cordiale (x questo Etiihad non può trovare solo persone carine e coccolose). Puntualità voto 10, transfert bagagli ok, coincidenze ok. La pecca più grossa è la prenotazione dei posti che sono a pagamento fino a 30 ore prima del volo (30 ore ??? fare 1 o 2 giorni interi no?). il problema nasce quando viaggi con dei minori che, a detta di tutti quindi credo non solo nella mia testolina, essi devono viaggiare sempre accompagnati da un adulto. noi su 5 voli presi (4 Etihad ed uno in collaborazione con Alitalia) abbiamo avuto solo 2 voli i posti preassegnati in fianco uno all' altro, nei restanti 3 voli (2 da 4,5 ore ed uno da 1) avevamo 4 posti completamente divisi. Quindi è iniziato tutto il cinema per cambiarli, perché puoi farlo solo all' aeroporto base della compagnia, quindi ad Abu Dhabi (o Roma per Alitalia). Nella app non si può, al call center nemmeno, al tuo aeroporto di partenza nemmeno... insomma sembra fatto apposta per farti pagare i posti, oltre ad averli già pagati nell' acquisto del volo ovviamente, con cifre che partono dagli 8€ a volo a testa, nel mio caso avrei speso altri € 160,00 come minimo... no comment (anche perché lo scopri a posteriori che i posti li hai divisi e non puoi più cambiarli manco a pagamento.
Mauro G|settembre 2019|Milano|Bangkok|Internazionali|Economy|4.0|Viaggio ottimo, tranquillo e rispettato gli orari.|Mi sono sentito molto bene, ben servito, e con orari rispettati al minuto. Solo per quanto riguarda il cibo si potrebbe migliorare.
Stefano C|settembre 2019|Roma|Sydney|Internazionali|Economy|4.0|HO AVUTO FIDUCIA|Se non fosse stato per il volo/ tratta Abu-Dhabi - Sydney, la mia recensione sarebbe stata con qualche punto in meno a questa Compagnia! Perché avendo fatto Roma - Abu-Dhabi con un veicolo di Etihad un po’ scadente (con monitor che non funzionava molto bene, sedili un po’ troppo vecchi e stretti), il volo successivo come sopra menzionato è stato a dir poco sbalordivo ( aereo nuovo di zecca, monitor di alta qualità, sedili con postazione larga e comodi, vista la mia altezza). Complimenti, dopo le recensioni lette, mi devo ricredere su questa compagnia! Bravi! Per quanto riguarda il cibo, anche qui do’ la mia sufficienza, essendo italiano, ci si aspetta sempre il massimo! Equipaggio bravi, compresivi ed efficienti! Quindi avete avuto la mia fiducia. Continuate così! Stefano!
Sirin|settembre 2019|Abu Dhabi|Bologna|Internazionali|Economy|1.0|Personale di terra|Pessimo personale! Partendo da Roma mi hanno chiesto di mostrare la carta di credito con cui ho prenotato il volo, e dopo averlo fatto mi hanno assicurato che non me l’avrebbero più chiesta, che potevo partire tranquilla. Al ritorno da Abu Dhabi mi richiedono di presentarla o di fare un altro biglietto. Non avendola dietro, e avendo solo una foto non l’hanno accettata e quindi mi è toccato rifare un altro biglietto, più di 500€! Personale pessimo con aereo eccellente, peccato
Raffaele S|agosto 2019|Milano|Abu Dhabi|Internazionali|Economy|4.0|Economy|Aereo confortevole, spazio per le gambe piu' che accettabile, puntualissimo, cibo a bordo vario e ottimamente cucinato, personale di bordo gentile e professionale, e' la mia compagnia aerea preferita, tanto e' vero che sono diventato Gold Guest, visti i miei frequenti spostamenti.
Christian C|NULL|Zurigo|Abu Dhabi|Internazionali|Economy|3.0|NON PER TUTTI|Cibo buono volo in orario però lo spazio tra i sedili è piuttosto contenuto e per quelli più alti è probabilmente è un problema. Successivamente ho volato con la stessa compagnia per Kuala Lumpur ed anche altro aereo Boing 787 lo spazio non era ampio.
Mauro G|agosto 2019|Bangkok|Milano|Internazionali|Economy|3.0|Volo Etihad|Un volo direi normale, un buon servizio, e massima puntualità. Cibo niente di speciale, ma non male.
Giovanni C|agosto 2019|Milano|Singapore|Internazionali|Business|4.0|Comfort e Cortesia|Volo andata e ritorno per una vacanza a Singapore. Ottima accoglienza a bordo e nelle lounge a terra. Il sedile nella tratta Malpensa-Abu Dhabi, appena salito a bordo, non era comodissimo, probabilmente perché il coprisedile era stato montato male, non sufficientemente teso, ma il personale di bordo si è prodigato per risolvere il problema ed il volo è trascorso tranquillamente. Decollo ed atterraggio particolarmente confortevoli in tutte le tratte del volo. Ottimo il servizio di bordo, buona qualità delle bevande e del cibo. Particolarmente gustoso il panino con la bistecca. Nel volo di ritorno, per la tratta Abu Dhabi-Malpensa, ci è stato offerto un upgrade in prima classe e l'esperienza è stata ancora superiore, veramente da provare. Ottima compagnia aerea e servizio eccellente.
Chiara M|agosto 2019|Roma|Bangkok|Internazionali|Economy|3.0|Sedili strettisismi|Sedili strettissimi personale poco cordiale 2 film in italiano very old style coperte piccole nessun confort
WILLIAM P|NULL|Milano|Abu Dhabi|Internazionali|Economy|4.0|Livello buono ma.....|Il voli da Milano ad Abu Dhabi e poi fino a Singapore hanno riscontrato le stesse problematiche : 1) sedili che a fatica si reclinano (problema giá scritto da molti) e leggermente piú stretti della media 2) la qualitá del cibo....pessimo davvero...molto meglio altre compagnie tipo Emirates o Thai o Alitalia stessa...al contrario il servizio on board di stewards e hostess è stato molto buono. Buona la scelta di film a bordo ma pochi molto pochi quelli in lingua italiana.
Alessia A|agosto 2019|Bangkok|Milano|Internazionali|Economy|4.0|PUÒ ANDARE MA...|Abbiamo viaggiato da Bangkok a Milano con scalo ad Abu Dhabi. Do 4 stelle e non 5 perché secondo me ci sono alcuni aspetti da migliorare. Aspetti positivi: voli in orario, vasta scelta di film, hostess disponibili e cibo buono per essere su un volo di linea. Aspetti negativi: sedili molto stretti rispetto ad altre compagnie e non mi è piaciuto il trattamento che hanno riservato al mio compagno all'aeroporto di Abu Dhabi: ci hanno fatto aspettare fuori dal gate prima che salissero tutti i passeggeri per controllare il suo visto, ritenendolo falso, mentre a persone con il viso coperto non veniva chiesto nemmeno di scoprirlo per controllare il passaporto.
GiuGioMonza|luglio 2019|Milano|Tokyo|Internazionali|Economy|5.0|Prima nostra esperienza con questa compagnia promossa a pieni voti|"Abbiamo viaggiato a/r dall'Italia al Giappone (con scalo ad Abu Dhabi ovviamente) prendendo per la prima volta in vita nostra questa compagnia. Abbiamo letto recensioni che, ultimamente, viravano al negativo della serie ...non e` piu` come una volta. Per nostra fortuna abbiamo avuto un ottima esperienza. Non possiamo fare paragoni col passato ma viaggiando in Economy abbiamo davvero colto al volo un ottima offerta (prenotata mesi prima ovviamente) avendone in cambio un trattamento piu`che adeguato. Non abbiamo pagato extra per riservare i posti ma siamo finiti vicini ugualmente. Pasti sopra la media della categoria, idem per intrattenimento a bordo e livello dei sedili e delle forniture. Sicuramente una compagnia che terremo in considerazione per viaggi futuri verso ""l'Est del mondo"""
Antonio C|agosto 2019|Roma|Johannesburg|Internazionali|Economy|4.0|Buona compagnia ma mi aspettavo di meglio|Ero francamente molto curioso di provare questa compagnia aerea, mi aspettavo qualcosa stile Emirates o Qatar, ma francamente sono rimasto un po’ deluso. Ottimi gli aeromobili , sufficiente il cibo (non il massimo in qualità e quantità ), scarso lo spazio a disposizione. In definitiva buona ma non paragonabile ad altre compagnie degli Emirati tipo Emirates e Qtar!
Paola R|NULL|Melbourne|Abu Dhabi|Internazionali|Economy|1.0|Compagnia aerea scorretta e da evitare|Abbiamo comprato un posto in economy class per il lungo volo da Melbourne ad Abu Dhabi con mesi di anticipo per un problema alla schiena di mio marito.Al momento dell'imbarco ci rendiamo conto che il sedile non è reclinabile costringendo ad un viaggio con sedile in posizione eretta per circa 14 ore di volo. Alle nostre lamentele intervengono i membri dell'equipaggio che con maldestri tentativi riescono a declinare un po' lo schienale ma assolutamente non al livello degli altri sedili.Dopo un viaggio scomodissimo ci suggeriscono di scrivere un reclamo e che anche loro rediggeranno una relazione sui fatti accaduti. Tornati scriviamo in reclamo alla compagnia dicendo che prima di vendere a più di 30 euro dei posti si dovrebbero prima verificarli. Ci aspettavamo almeno delle scuse e al limite il rimborso del prezzo pagato. Invece,dopo alcuni giorni,ci risponde una certa Greta(senza cognome) che non solo non si scusa ma dice di aver verificato il rapporto del personale dell'aereo che smentisce i fatti e ci fa apparire come persone che si sono inventate tutto e che il sedile non aveva nessun problema.Vi sembra che questo modo di fare non sia offensivo per il cliente che oltre al danno si sente anche trattato da bugiardo?
Fabio B|agosto 2019|Roma|Jakarta|Internazionali|Economy|2.0|In continuo peggioramento|Anche quest'anno, dopo confronto di prezzi ed orari, ho optato per viaggiare con Etihad, da Roma a Jakarta e viceversa, con scalo ad Adu Dhabi e Singapore (solo per il viaggio di ritorno). Rispetto alle precedenti esperienza ho trovato molti punti che sono nettamente peggiorati. L'unico lato positivo è stata la puntualità di tutti i voli, la facilità dell'utilizzo del sito e le procedure per il drop-off bagagli. Ma gli aspetti negativi sono tanti. 1. prezzo molto alto (attorno agli 850 Euro), per i voli ad agosto, pur prenotando con due mesi di anticipo. 2. come le peggiori low-cost è necessario pagare salatamente per scegliere anche i posti a sedere sui vari voli. Pessimo! Fino all'anno scorso non era così. 3. food & beverage nettamentte peggiorato nelle quantità e nella qualità: il pasto principale è costituito da una scelta tra due o tre cibi caldi (quasi immangiabili, pesanti), un piccolo dolcetto, un minipanino; non c'è più frutta, né l'acqua confezionata; per il volo partito di notte da Abu Dhabi, poco dopo la partenza è stato offerto un sandwich orribile, con delle verdure cotte filacciose ed olive, salatissimo. In generale poca scelta di bevande. Davvero tutto peggiorato. 4. in generale il servizio di hostess e steward è approssimativo, non coordinato, con tempi lunghissimi. 5. spazio tra i sedili accettabile sulla tratta Roma - Abu Dhabi (su B777), ma inaccettabile sulle sulle lunghe tratte tra Abu Dhabi e Jakarta e Singapore. Una nota positiva sulla tratta Jakarta - Singapore operata dalla compagnia indonesiana Garuda in code-sharing: pur durando il volo solo due ore, il pasto è molto più ricco, l'aeromobile, più comodo, il servizio generale molto migliore. Il giudizio globale quindi non può essere che negativo, soprattutto considerando come era Etihad anni fa. Per i prossimi viaggio verso il sud-est asiatico cercherò di trovare un'altra soluzione.
francesco m|luglio 2019|Roma|Abu Dhabi|Internazionali|Economy|3.0|Mi aspettavo di più|Recentemente ho fatto quattro voli con Etihad Airlines da Roma ad Abu Dhabi, da Abu Dhabi a Shanghai, da Shanghai ad Abu Dhabi e da Abu Dhabi a Roma. Comodità: ho trovato i sedili molto scomodi, seduta dura, spazio sufficiente da e per gli Emirati Arabi, insufficiente da e per Shanghai per un volo di quasi nove ore. Cibo: non all'altezza della compagnia che vorrebbe fare concorrenza ad Emirates Airlines. Per i voli con partenza in tarda serata o nelle prime ore della notte hanno offerto un panino immangiabile, molliccio con peperoni, molto difficili da digerire! .  Personale di bordo e di terra: l'aspetto migliore del volo. Durante il volo da Roma ad Abu Dhabi qualche fila centrale, tra cui la nostra, non ha potuto usufruire dell'intrattenimento perchè non funzionante. Le partenze e gli arrivi sono stati puntuali. Stop over: macchinosa la procedura, prezzi degli alberghi convenzionati superiori a quelli indicati su qualsiasi motore di ricerca, per cui non conviene prenotarli tramite Etihad ma direttamente dal sito dell'hotel o dalle varie agenzie on line. In poche parole è soltanto uno specchietto per le allodole. Trasporto gratuito con bus Etihad da Abu Dhabi a Dubai: utile e conveniente ma attenti agli orari di prenotazione. A me è capitato di aver prenotato per un orario e, successivamente, aver tentato di cambiare l'orario. Ho contattato Etihad e mi hanno rassicurato dicendomi che non era necessario modificare l'orario della prenotazione perchè bastava presentarsi al punto di raccolta e prendere il bus all'orario preferito. Sbagliato! Io ho seguito le loro indicazioni e mi sono ritrovato fuori dal bus perchè era pieno e i prenotati avevano, giustamente, la precedenza. Forte dell'esperienza all'andata, al ritorno, volendo cambiare l'orario, ho provato a contattare gli uffici Etihad in Emirati. Impossibile parlare con qualcuno, al telefono non hanno risposto per due giorni consecutivi, nonostante i continui tentativi fatti dall'addetto alla reception del mio albergo di Dubai al numero dedicato sul sito ed ad un altro numero di Etihad In futuro, farò di tutto per evitare di volare con Etihad  I recently made four flights with Etihad Airlines from Rome to Abu Dhabi, from Abu Dhabi to Shanghai, from Shanghai to Abu Dhabi and from Abu Dhabi to Rome. CoMFORT: I found the seats very uncomfortable, hard seats, sufficient space to and from the UAE, insufficient space to and from Shanghai for a flight of almost nine hours. Food: not up to the level that company would like to compete with Emirates Airlines. For flights departing late in the evening or in the early hours of the day they offered an inedible, soggy sandwich with peppers, very hard to digest! . On-board and ground personnel: the best aspect of the flight. During the flight from Rome to Abu Dhabi some central rows, including ours, could not enjoy the entertainment because it was not working. Departures and arrivals were punctual. Stop over: the procedure is complicated, the prices of the affiliated hotels higher than those indicated on any search engine, so it is not advisable to book them via Etihad but directly from the hotel website or from the various online agencies. In a nutshell, it's just a lark mirror. Free transportation with Etihad bus from Abu Dhabi to Dubai: useful and convenient but attentive to booking times. I happened to have booked for a time and then tried to change the time. I contacted Etihad and they reassured me by telling me that it was not necessary to change the booking time because it was enough to show up at the collection point and take the bus at the preferred time. Very wrong! I followed their directions and found myself off the bus because it was full and the reserved ones had the right of way. Thanks to the precedent experience, on my return trip, when I wanted to change the time of the reservation, I tried to contact the Etihad offices in the Emirates. Unable to talk to anyone, they did not answer on the phone for two consecutive days, despite the continuous attempts made by the receptionist of my Dubai hotel at the dedicated number on the site and another Etihad number In the future, I will do everything to avoid flying with Etihad
Fabrizio P|NULL|Roma|Bangkok|Internazionali|Economy|3.0|Delusione..|Forse avevo aspettative troppo alte per questa compagnia.. Fatto sta che sono rimasto deluso, sia dall'offerta che dalla qualità del prodotto multimediale, servizio medio, cibo medio, nulla che mi abbia indotto a pensare di volare con la compagnia numero uno al mondo. Da rivedere..
Davide G|agosto 2019|Milano|Kuala Lumpur|Internazionali|Economy|5.0|Capo scalo Milano Malpensa Khatia insuperabile|Voglio ringraziare Khatia il capo scalo di oggi 10 agosto 2019 Etihad di Milano MXP per un eccellente customer care.  Grazie mille Davide
Thaumasios|NULL|Milano|Mascate (Muscat)|Internazionali|Economy|4.0|Tutto buono|Si è trattato di 4 buoni voli, via Abu Dhabi. 4 su 4 in orario, cibo servito buono, intrattenimento, coperte, cuffiette, tutto nella norma. Solo l'allestimento dei sedili, in termini di distanza potrebbe essere migliore, con sedili più lontani e quindi più spazio per le gambe. Da aggiungere e non è poco, che sia andata, sia ritorno, presenza di personale di cabina, di madre lingua italiana. Spero solo in tariffe più competive per il sudest asiatico.
iae2013|luglio 2019|Bruxelles|Bangkok|Internazionali|Economy|1.0|carro bestiame|Il viaggio è stato veramente pesante perchè avevamo poco spazio per le gambe ed era impossibile dormire.Pessimo e scarso il cibo che ci è stato offerto.Hostess fantasma .Insomma più che classe economica era classe bestiame.Piccolo dettaglio ad Abu Dhabi ,di sera 40° ,siamo stati , noi della classe bestiame, ammassati su una navetta forno e lasciati ad attendere 15 mn che questa partisse,mente quelli della classe business godevano di una navetta spaziosa e rinfrescata.Trovo che queste suddivisioni siano medioevali e inaccettabili
Antonio D|luglio 2019|Roma|Chengdu|Internazionali|Economy|3.0|Da compagnia leader a compagnia quasi low cost|Dopo alcuni anni ho ripreso un volo Etihad per recarmi a Chengdu via Abu Dhabi e sono rimasto fortemente perplesso nel vedere scivolare una compagnia come Etihad a livello di compagnie low cost. Spazi ridotti tra un posto e L altro, poco personale e servizi a bordo scarsi. Il catering era poi quasi offensivo nella sua pochezza e nella sua qualità . Un vassoietto scarso di cibo di pessima qualità, bevande ridotte all osso ( solo coca e sprite, neanche Fanta o acqua gasata) insomma: delusione assoluta.
rino b|luglio 2019|Singapore|Roma|Internazionali|Economy|3.0|Buona ma ...|Il viaggio non è stato malvagio ma con il solito problema vale a dire che di notte si gela malgrado la coperta, ottimo invece il cibo, peccato non ci siano annunci in italiano
Francesco C|giugno 2019|Abu Dhabi|Pechino|Internazionali|Economy|3.0|aereo migliore rispetto ad altri...moderno.|questo secondo volo da Abu Dhabi a Beijing è stato sicuramente migliore, il velivolo moderno, pulito e con possibilità di interazione con lo schermo superiore. ottimo lo staff, sempre presente, siamo arrivati anche in anticipo.
Francesco C|giugno 2019|Roma|Abu Dhabi|Internazionali|Economy|3.0|un volo come un altro|Volo con scalo, il primo volo è partito da Roma per Abu Dhabi,il velivolo era vecchio, non eccessivamente pulitore i colori interni lo rendevano ancora più sporco. le Hostess e il personale sempre presenti, quindi nulla da dire,dato che siamo arrivati in orario.
Tiziana B|gennaio 2019|Milano|Abu Dhabi|Internazionali|Business|5.0|VOLI ABU DHABI|Meravigliosi voli, l'eccellenza degli aperitivi a bordo...cibo ottimo e piatti curati nella presentazione, servizio ineccepibile
Biagio G|gennaio 2019|Roma|Bangkok|Internazionali|Economy|4.0|ottima compagnia con buoni servizi|Posti comodi buona puntualita nel rispetto degli scali.Rispetto nell ordinativo dei pasti per in particolare in quanto intollerante al lattosio.
Anna De Chiaro|agosto 2018|Roma|Kuala Lumpur|Internazionali|Economy|4.0|Ottima compagnia|Servizio eccellente, è una garanzia, puntualità efficienza cortesia. Viaggio lungo, con scalo a Abu Dhabi, tutto Etihad, aerei non nuovissimi, ma impeccabili.
Miripupa|NULL|Abu Dhabi|Milano|Internazionali|Business|5.0|Ottimo!!!|Con l'asta online ci siamo Aggiudicati ad un prezzo accettabile il volo in business al ritorno da Abu Dhabi.... Top!!! Terminal dedicato alla business, così come i controlli e la Lounge dotata di SPA dove mi sono fatta fare un massaggio ai piedi prima del volo favoloso! La business è molto bella, curata, si mangia molto bene peccato per una turbolenza che ci ha tenuti svegli 1h e mezza mamma mia.... Per il resto riposato e volato divinamente, consigliatissima comunque sia in economy che in business!!
Let135|agosto 2018|Dar es Salaam|Roma|Internazionali|Economy|4.0|Ottima scelta|Questa è stata la seconda volta a bordo di Etihad e l'esperienza ancor più positiva della prima. Il prezzo del biglietto più che competitivo per i servizi ricevuti. Possibilità di scelta dei posti, nessuna limitazione ai bagagli, cabina comoda e pulita. Pasti a bordo della norma e possibilità di bere vino/birra. Lo scalo ad Abu Dhabi non risulta pesante e i voli sono stati puntualissimi
Sonia S|giugno 2019|Roma|Bangkok|Internazionali|Economy|1.0|Posti stretti come Ryanair|Non e’ possibile che in un volo di linea con durata 12h in economy si stia stretti e non si riesca a stendere un minimo le gambe! Non tutti possono permettersi la business ma non trovo differenza a questo punto tra un volo con Ryanair e la Vs compagnia sia a livello di cibo sia al livello di scomodità. Di certo non viaggeró più con Etihad .
ROBITALIA|giugno 2019|Roma|Abu Dhabi|Internazionali|Business|3.0|Da una business mi sarei aspettato molto di più|Niente da dire sul nuovo 787 in business e sul layout dei sedili di business , forse poco intimi però , ma in quanto a qualità del cibo e a cortesia delle hostess , devo dire che la delusione è stata notevole. Trovo assurdo poi che non ci sia un cuscino pulito con per dormire come in ogni business Class. Ridicola la trousse di viaggio firmata Acqua di Parma.
Tiziana M|maggio 2019|Roma|Bangkok|Internazionali|Economy|3.0|POCO SPAZIO!!!|Mi spiace ma non posso dare più di tre stelle e non per il personale, molto gentile, o per la pulizia, quando ho usato il bagno era molto pulito anche se stavamo a fine volo. Però il posto per le gambe è praticamente inesistente, quando si affronta un volo di molte ore come ho fatto io da Roma ad Abu Dhabi e da Abu Dhabi a Bangkok e quando scendi ti fa male tutto, il resto si dimentica facilmente. Non posso dare un grande giudizio neanche sul cibo. Avevo richiesto opzione senza glutine, che regolarmente è arrivata, ma il pane doveva essere cotto e comunque non ho gradito neanche il resto. Magari un giorno riuscirò a viaggiare in prima classe e cambierò giudizio
Odisseo|maggio 2019|Abu Dhabi|Roma|Internazionali|Economy|4.0|Buona compagnia|Buona compagnia, aereo moderno, accogliente e sedili comodi. Partenza puntuale. Personale cordiale e professionale. Peccato che i film siano quasi tutti in lingua non italiana. Su un volo da/per l'Italia sarebbe carino trovare film anche i lingua italiana.
Wilma F|giugno 2018|Milano|Abu Dhabi|Internazionali|Economy|5.0|Ottima compagnia|Ottima compagnia aerea, con partenze puntuali, aerei grandi e personale di terra e a bordo gentile. Aeroporto grande e molto bello. Cibo a bordo buono.
Mario V|aprile 2019|Roma|Colombo|Internazionali|Economy|5.0|Professionalità ed efficienza.|Abbiamo volato su mezzi della ultima generazione come il Boeing 787, fenomenali! Intrayttenimento con una scelta infinita di film a scelta. Cibi veramente gradevoli, Bevande con birre e vino. Accudimento delle hostess impeccabile.
Matteo|maggio 2019|Roma|Bangkok|Internazionali|Economy|1.0|Alla fine mi hanno deluso più loro che tutte le compagnie low cost europee che ho preso fino adesso.|Etihad, compagnia degli emirati principale concorrete di Emirates, nonché, quest’ultima, una delle migliori compagnie aeree al mondo. Appena ho visto il volo per Bangkok, da Roma, con scalo nel loro hub principale ad Abu Dhabi, ho detto “sicuro sarà un ottimo volo”. Non è stato assolutamente così: comincia il 3 Maggio, quando arriviamo in aeroporto alle 9 di mattina, pronti per effettuare il check in, appena arrivati intravedo una fila enorme, una signorina dell’aeroporto di Fiumicino viene da me dicendomi che “il volo ha subito un guasto perció non si sa a che ora partirà”, cominciamo bene. Passano ore, e del volo non si sa nulla, non essendoci un banchetto Etihad all’interno di Fiumicino tutto avviene esternamente, tramite chiamate dalla sede a colui che fa da “capobanco” diciamo, perció i tempi cominciano ad allungarsi. Nell’attesa vedo un volo che parte da lì a poco per Bangkok con la Thai, e mi dico, magari mi faccio spostare su quello. Alle 12:00 la sentenza: l’aereo è rotto e ripartirà alle due di notte, tutti devo raggiungere l’hotel. E da lì il panico, gente arrabbiata che perde la coincidenza con un’altra compagnia, gente che aveva impegni lavorativi. Niente. Lasciati a terra così. Vado dal “capobanco” e gli chiedo se possibile spostarmi sul volo Thai che sarebbe partito tra un’ora e mezza così da risolvere la situazione. Nulla, niente, discussioni su discussioni, io mi arrabbio seriamente e dopo mezz’ora riesco, l’unico, a farmi spostare sul volo per Bangkok. Vi risparmio la parte di me che corro come un matto con le valigie per cercare di non perdere l’unica possibilità per arrivare a destinazione dato che hanno perso tanto di quel tempo, ma non vi risparmio il disagio enorme di questa situazioni e di come da giorni cerco di contattarli per richiedere il rimborso del ritardo ma senza risposta. Etihad, mi ha deluso davvero tanto. Il volo di ritorno è stato scomodo, il cibo pessimo, pochissimi film in Italiano. Siamo arrivati a Roma alle 6:30 e sarebbe stato l’ideale per le 5 sull’aereo qualcosa che assomigliasse ad una colazione, c’era si, ma era a pagamento, dopo 600€ di biglietto aereo devo pagarmi la colazione? Che pena vedere una compagnia del genere ridotta così. Mi dispiace ma non tornerò più a viaggiare con loro. Scegliete altro, tanto le loro stesse tratte le effettua anche Emirates, e fidatevi che sarà tutta un’altra storia.
