author|flightDate|flightFromCity|flightToCity|flightType|flightClass|mark|title|text
Ruggero1303|maggio 2019|Bangkok|Roma|Internazionali|Economy|1.0|Un incubo di 14 ore|Il volo da Bangkok a Roma fa scalo ad Abu Dhabi. Nella prima tratta la temperatura a bordo era fredda al limite del gelo, e ho visto uno steward tentare invano di regolare la temperatura. La seconda tratta del volo, su velivolo analogo, è stata ancor più fredda al punto che sono state distribuite le coperte in dotazione e la gente ha indossato berretti e giacche per difendersi dal gelo. Il personale di bordo non ha saputo far nulla per rimediare, e di conseguenza non siamo neppur riusciti a chiudere occhio. Un vero incubo, vergogna!
Angela F|NULL|Torino|Bangkok|Internazionali|Economy|3.0|Molto bene la prima tratta|Ci siamo trovati molto bene soprattutto nella prima tratta Mxp - Abu Dhabi. Nella seconda, invece, assistenza in volo scarsissima. Gli aeromobili sono praticamente nuovi, partenze sempre puntuali. Ci aspettavamo molto di più soprattutto per quanto riguarda l'intrattenimento. Film in italiano pochissimi...con quello che costa qs compagnia, si potrebbe offrire di più.
Cristiana|aprile 2019|Milano|Abu Dhabi|Internazionali|Business|3.0|Business deludente|Classe business non comparabile con altre compagnie per spazio delle sedute e comfort. Personale a bordo gentile E cortese, pasti buoni e buona scelta. Avevamo fatto il check in online selezionando posti vicini dalla mappa a disposizione, ma l'aereo aveva una conformazione diversa per cui non abbiamo viaggiato vicini.
Cristiana|maggio 2019|Abu Dhabi|Roma|Internazionali|Economy|2.0|Delusione|Classe economy molto scarna, neanche il kit di cortesia base dato il volo notturno, né passaggio colazione al mattino se non con carrello con caffe' Starbucks a pagamento. Personale di bordo scortese. Scelta posti a pagamento (102€/ea per economy extra). Molte compagnie offrono viaggio in economy molto più confortevole, e dato che si tratta della compagnia di bandiera degli EAU l'aspettativa era molto più alta.
maximelo|aprile 2019|Milano|Abu Dhabi|Internazionali|Economy|2.0|Delusione|Avevo già preso questa compagnia, ma il crollo del servizio è stato notevole, si stanno Alitalizzando :-) Pasto scarsissimo ed insignificante, almeno sono puntuali. Al ritorno devono aver messo qualche fila in più perché le gambe toccavano il sedile davanti. Partenza da Abu Dhabi alle 02 della mattina e dopo venti minuti quando tutti vorrebbero dormire servono con tutte le luci accese una specie di pasto che ovviamente quasi tutti rifiutavano. Il bello che al mattino, anziché offrire un po' di caffè con almeno un misero biscotto, passano a chiede se vuoi qualcosa a pagamento stile Easyjet. Con 600 euro di biglietto potreste fare meglio.
danielot|maggio 2019|Abu Dhabi|Roma|Internazionali|Economy|1.0|Overbooking e assistenza speciale...che brutta esperienza!!|"Mio marito ed io abbiamo prenotato un volo diretto A/R da Roma per Abu Dhabi, con servizio di assistenza con sedia a rotelle in aeroporto per mio marito. Premetto che nella mail di remind del check in on line, inviatami dalla compagnia aerea prima della partenza, era espressamente segnalato che ""se hai una richiesta di assistenza speciale, dovrai effettuare il check-in in aeroporto"". All'andata nessun problema, al ritorno, il dramma. Arriviamo in aeroporto ad Abu Dhabi e ci viene data la ferale notizia: non ci avrebbero fatto partire, poichè non vi erano più posti disponibili avendo tutti i passeggeri fatto il check in on line ed essendo il volo in overbooking! Trovo la cosa allucinante e scorretta: ai passeggeri con richiesta di assistenza non viene data la possibilità di fare il check in on line e per questa ragione, anzichè essere agevolati, si viene discriminati e penalizzati. Siamo potuti partire solo il giorno dopo, con tutti i disagi del caso (impegni di lavoro saltati e utilizzo di giorni di ferie non preventivati). Non mi sembra un comportamento eticamente corretto e ritengo che, in presenza di soggetti con richiesta di assistenza, il posto a bordo debba essere sempre garantito. La compagnia aerea ha comunque provveduto alla nostra sistemazione in albergo con pensione completa ed alla emissione di un voucher di 300$ a persona, da utilizzare entro 12 mesi per l'acquisto di un nuovo volo, cifra che non copre nemmeno la metà del costo del biglietto che abbiamo sostenuto."
enzo b|marzo 2019|Milano|Malé|Internazionali|Economy|4.0|da consigliare|Orari di partenza ed arrivo rispettati, spazi abbastanza comodi per distendere le gambe. Personale gentilissimo. Diversi applicativi di intrattenimento, ci potrebbero essere più film in italiano.
robi&gil|aprile 2019|Trieste|Nuova Delhi|Internazionali|Economy|2.0|Arriveremmo in India?|Piu' che una recensione illustrerò cosa mi sta succedendo. Poi a ognuno la facoltà di opinione se fidarsi ancora di Etihad o no..... Abbiamo prenotato dei voli da Trieste a Delhi per il giorno 17 Maggio 2019 (ho indicato Aprile solo perché il campo è obbligatorio) scegliendo Etihad che ci forniva voli con orari perfetti per il nostro viaggio. Beh, da Marzo ad oggi è stato un continuo cambiare orari dei voli procurandoci gravi disagi in quanto abbiamo anche già programmato tutti i servizi a terra (tour, guida,autista....): - variazione 1: da Abu Dhabi a Delhi il volo in partenza alle 08:10 partirà alle 08:20, beh, poco male solo 10 minuti di differenza. - variazione 2: da Abu Dhabi a Delhi il volo in partenza alle 08:20 partirà alle 14:25, con un aumento significativo delle ore da passare in aeroporto! - variazione 3: da Roma ad Abu Dhabi il volo che doveva partire alle 22:00 partirà alle 11:00 del giorno dopo!! Più di 14 ore in aeroporto e poi il volo da Abu Dhabi a Delhi in partenza alle 14:25 viene spostato alle 22:15 facendoci arrivare a Delhi alle 03:15 invece delle 19:40 facendoci pagare una notte d'albergo per starci un paio di ore solo. - variazione 4: da Abu Dhabi a Delhi il volo in partenza alle 22:15 viene anticipato di 1/2 ora..... Sarà l'ultima variazione??? E tutto questo senza il minimo interessamento da parte di Etihad sulle conseguenze che queste loro variazioni comportano sul nostro programma di viaggio.
marilenavita|aprile 2019|Milano|Tokyo|Internazionali|Economy|3.0|Cibo pessimo|Considerata la lunghezza dei voli i sedili sono abbastanza scomodi ma quello che è veramente orribile è il cibo che servono. Proprio immangiabile e per di più servito ad orari strani. Ci hanno svegliati in piena notte per darci del pollo o del pesce disgustosi e al mattino prima dell’atterraggio neanche un caffè o qualcosa che assomigliasse ad una colazione. Se proprio dovete viaggiare con loro portatevi il vostro cibo!!
Niccolo764|aprile 2019|Abu Dhabi|Roma|Internazionali|Economy|1.0|Overbooking vergognoso|Sono appena atterrato a Roma dopo un viaggio da Abu Dhabi per Roma via Francoforte. Oltre al problema del check-in segnalato dal precedente viaggiatore in quanto avevamo una connection con Alitalia, questa mattina all’imbarco ci siamo trovati di fronte ad un overbooking vergognoso in cui non ci volevano far partire tutti insieme, rinviando il rientro al giorno dopo. Viaggiavo con moglie e bambini relativamente piccoli. Ci siamo dovuti accampare al check-in per un’ora chiedendo del responsabile ecc e solo di fronte alle nostre vibrantissime proteste ed insistenze ci hanno imbarcato facendoci prendere l’aereo di corsa con i bambini piuttosto agitati ... ovviamente arrivati a Roma bagagli vaporizzati .... domani impegnerò la mia giornata a fare giustizia!
Tudu|marzo 2019|Johannesburg|Londra|Internazionali|Economy|2.0|Una terribile odissea|Abbiamo viaggiato da Johannesburg a Londra via Abu Dhabi. Il viaggio si è trasformato in un’odissea, a causa di un ritardo in partenza di 10 ore. La partenza, prevista per le 20, è stata effettuata alle 5 del mattino. Quella successiva, da Abu Dhabi per Londra, alle 2.50 del mattino successivo. Due notti in bianco, passate tra un hotel e l’altro, correndo tra gli aeroporti. Le valigie sono state imbarcate e la Compagnia non ha nemmeno fornito un kit di cortesia da viaggio. Alla fine siamo arrivati il giorno dopo rispetto a quello previsto. Avevamo chiesto espressamente di essere riprenotati su un volo alternativo operato da altro vettore (c’erano almeno 3 voli in partenza per Londra, in grado di portarci a destinazione lo stesso giorno) ma la compagnia si è rifiutata. Catering a bordo scadente. Cibo insufficiente. Snack a pagamento. Al momento sono in attesa che il nostro complain riceva riscontro dalla Compagnia.
gp_prandi|aprile 2019|Abu Dhabi|Roma|Internazionali|Economy|2.0|pessima esperienza|se volate dall'Italia e verso l'Italia con Etihad e un volo di Alitalia in coincidenza, scordatevi di fare il Check in on line. Le due compagnie non si parlano e i loro sistemi non sono connessi...risultato si deve andare al check inn in aeroporto come 10 anni fa (e fare le code) ....incredibile ma vero. oltre a ciò il servizio è pessimo....partenza da Abu Dhabi alle 2 del mattino, mi addormento quasi subito e dopo circa mezz'ora vengo bruscamente svegliato da una hostess che mi intima di ricevere la cena...alle 3 del mattino... (devo aver risposto malamente)...al mattino successivo nessuna colazione viene servita ...neanche un caffè ......io sono un viaggiatore di lungo corso ma un servizio così non mi era mai capitato...mai più
Patrizia M|marzo 2019|Milano|Abu Dhabi|Internazionali|Economy|4.0|Volo confortevole|Puntualissimi, anzi con qualche minuto di anticipo. Posti abbastanza comodi anche per le gambe (ma io sono piuttosto piccola!). Personale gentilissimo. Molto utili cuscino e copertina perché si moriva di freddo. Molti film disponibili, recenti e in italiano. Pasto servito fuori orario, alle 11 e mezza come in ospedale! Al ritorno, partita alle 2 di notte, ho fatto colazione alle 4. Presto dovrò tornare negli Emirati e penso che volerò di nuovo Etihad.
Davide P|aprile 2019|Milano|Abu Dhabi|Internazionali|Economy|5.0|CONFORT CON ETIHAD|Ottimo volo con la compagnia Etihad Airways volo per le maldive andata e ritorno abbiamo preso 4 aerei Airbus A 330- 300 jet e di questa compagnia ,su tutti decollo e atterraggio perfetti ,cordialità e confort a bordo e servizio di cena e pranzo perfetti,menu internazionale . Servizio buono al checkin a Milano Malpensa con il personale Etihad .
Daniela M|marzo 2019|Nuova Delhi|Milano|Internazionali|Economy|1.0|Sedili piccoli, poco spazio per le gambe su viaggi Intercontinentali, staff maleducato|Il nostro volo e' stato annullato. Ci e' stato comunicato un nuovo volo errato, e abbiamo scoperto solo per caso il volo che ci era stato effettivamente assegnato. Per poter prenotare i posti abbiamo dovuto chiamare dall'India a Abu Dhabi. Abbiamo richiesto posti con spazio extra per le gambe, ci hanno addebitato 280 Eur ma i posti prenotati erano vicino all'uscita di emergenza - quindi ancora piu' stretti e corti - sul primo volo per Abu Dhabi e assolutamente normali sul secondo per Milano. Lo staff ha detto che non risultava loro nessun pagamento, nonostante avessimo mostrato loro l'avvenuto addebito su carta di credito.... Abbiamo contattato il servizio clienti online, abbiamo ricevuto una risposta standard e poi piu' nulla. A tutto cio' c'e' da aggiungere la mancanza di gentilezza del personale e il cibo di pessima qualita'.
Apispettore|aprile 2019|Milano|Kuala Lumpur|Internazionali|Economy|4.0|Ci siamo ma manca qualcosa|Abbiamo volato con questa compagnia da Malpensa a Kuala Lumpur, con scalo ad Abu Dhabi.  Nella tratta Milano-Abu Dhabi, gli aereomobili sono più datati, invece nella tratta da Abu Dhabi a Kuala Lumpur abbiamo volato con dei nuovi Boeing Dreamliner.  Intrattenimento buono con diversi film in italiano.  Prenotato con largo anticipo, il prezzo era pressoché imbattibile.  Unica “pecca” i posti a sedere, puoi sceglierli solo se paghi, ma comunque spaziosi e comodi.  Manca poco per essere al livello Emirates.
71fede|NULL|Roma|Abu Dhabi|Internazionali|Economy|4.0|Migliorabile|Volo assolutamente in orario, anzi, siamo addirittura arrivati 30 minuti prima del previsto. L' aereo sembra un po' datato, l' intrattenimento a bordo scarsino, pochissimi i film in italiano e pure vecchiotti. Inoltre, fino alla partenza i video non funzionano e prima dell'atterraggio il film che stai guardando viene bruscamente interrotto. Personale efficiente ma molto poco sorridente. Cibo standard. Per essere la compagnia di bandiera direi che si può dare/fare di più. Ps: niente a che vedere con Emirates...
swissgio|marzo 2019|Milano|Abu Dhabi|Internazionali|Economy|3.0|Sotto le aspettative|Orario rispettato al minuto sia all’andata che al ritorno. Personale molto disponibile. Peccato che l’aeromobile fosse evidentemente datato. Ho scelto i posti con spazio per le gambe ma ho sofferto il freddo con correnti da ogni lato. Entertainment malfunzionante. Per un volo di 6.5 ore sono aspetti importanti. Colazione immangiabile.
Always Ithaka|giugno 2018|Milano|Kathmandu|Internazionali|Economy|4.0|Ottimo volo|Il servizio di Ethiad è davvero notevole. Il personale è molto preparato ed attento alle esigenze dei clienti. Il catering era buono ed è stato servito con celerità singolare a tutti i passeggeri. Il volo è stato piacevole e il pilota ha saputo gestire egregiamente un paio di turbolenze di troppo. L'intrattenimento fornito dallo schermo personale era molto vario. Compagnia consigliata!
Paolopix|aprile 2019|Abu Dhabi|Roma|Internazionali|Economy|3.0|Personale di bordo ottimo|"Io e mia moglie il 3 Apile 2019, siamo saliti sull'aereo diretto a Roma, (dopo lungo e alquanto scomodo volo EY485 e dopo indicazioni sbagliate da parte del vostro personale di terra in aereoporto e dopo controllo dogana pessimo) abbiamo sentito una voce italiana che ci ha accolto con estrema disponibilità, simpatia, cordialità e professionalità. ""Roberta"", ci ha sollevato lo spirito e rinfrancati ed a cui va un nostro GROSSISSiMO Ringraziamento (20J e 20K) e vi prego di metterla a conoscenza di ciò! Paolo e Carla provenienti da Brisbane"
Spirto gentil|marzo 2019|Abu Dhabi|Roma|Internazionali|Economy|2.0|Se possibile scegliete di meglio|Volo FCO/Abu Dhabi e ritorno. Volo di andata con arrivo prestissimo senza nemmeno un caffè. Al ritorno schermo che non funziona. Mia moglie è più fortunata: il suo funziona e almeno lei può vedere l'unico film in italiano tra le centinaia di pellicole proposte. In ogni caso posti scomodissimi, spazi limitati come (se non peggio) nelle più scarse low cost.
Riosaeba|marzo 2019|Phuket|Roma|Internazionali|Economy|3.0|Insomma|Spazzi troppo ristretti per voli a così lunga percorrenza, sedili duri e scomodi, il cibo a bordo lasciamo proprio perdere, le bevande almeno si salvano. Ad Abu Dhabi il personale di terra é poco e male organizzato, volo partito con quasi due ore di ritardo, nel complesso a malapena sufficiente per il rapporto qualità prezzo.
roberto85sga|marzo 2019|Roma|Malé|Internazionali|Economy|4.0|BUONO|Servizio nella media cosi' come il cibo...l'intrattenimento a bordo e' un po scarso (pochissimi film in italiano)....volo piacevole e personale gentile.
ivan20164|marzo 2019|Milano|Malé|Internazionali|Economy|4.0|Pensavo meglio|Avendo viaggiato negli ultimi due anni con Emirates e Qatar mi aspettavo lo stesso livello di comfort , invece Etihad la collocherei un gradino sotto le due linee aeree citate prima. Non parlo della comodità dei sedili e del servizio ma mi riferisco al cibo e all'intrattenimento visivo. Sia all' andata che al ritorno ho chiesto carne e mi è stato risposto che era finita. FINITA???? Non esiste , non mi era mai successo. E poi la maggior parte dei film (circa il 90 %) non era possibile ascoltarli in lingua italiana .OK non è la lingua più parlata al mondo ma una traduzione in più penso possa migliorare la qualità del servizio. Abbastanza e decisamente deluso.
pietro c|gennaio 2019|Milano|Bangkok|Internazionali|Economy|5.0|Viaggio rilassante nonostante la durata e lo scalo intermedio|Siamo soddisfatti del viaggio in quanto il servizio a bordo è stato di nostro gradimento. Personale molto cortese, i pasti serviti erano ben curati e con possibilità di scelta del menù. Inoltre gli orari sono stati rispettati.
Fiorella P|marzo 2019|Roma|Mascate (Muscat)|Internazionali|Economy|3.0|Verso la Svizzera del mondo arabo|"Il nostro viaggio per l’Oman comincia con il Volo Roma-Abu Dhabi-Muscat con la Compagnia degli Emirati “Ethiad” che significa unione"" (الإتحاد). Un viaggio abbastanza comodo, ma con una organizzazione che abbisogna di una messa a punto che ponga al centro il cliente. Perché dico questo? Perché ci hanno fatto pagare in più per l’assegnazione dei posti oltre al biglietto e la chiamata al numero verde di Milano. Ma siete matti?  Inoltre le indicazioni da parte delle hostess di terra sono lacunose: rischi di perdere l’aereo anche se sei arrivata due ore prima, perché sono assolutamente imprecise sui tempi di percorrenza per raggiungere il controllo e le uscite. Per fortuna noi siamo super prudenti!  Un velo pietoso sul cibo a bordo.  Caro lettore aggiunto qualche informazione pratica:  1- per l’Oman serve un visto di ingresso che si fa SOLO attraverso posta elettronica, insomma ormai dobbiamo fare tutto noi (il bello è che ti dicono: ”così non devi andare al Consolato”). Ma redigere la richiesta è al limite della demenzialità per il formato utilizzato. Provare per credere e armarsi di santa pazienza.  2- il cambio di valuta penalizza fortemente l’Euro e quindi tutto diventa molto costoso.  3- la contrattazione è d’obbligo, prima di tutto perché quando acquisti, nel contrattare dai valore alla merce, poi è uno stile e con i tassisti una tua tutela."
r_galbiati|agosto 2018|Milano|Perth|Internazionali|Economy|4.0|Sotto le aspettative|Ho viaggiato con la mia famiglia quattro persone in Australia andata e ritorno con etihad. Premesso che in precedenza ho utilizzato emirates e quatar la compagnia etihad ha evidenziato sedili più scomodi e meno spazio per una tratta molto lunga . Non prenoterei nuovamente con loro anche perché il costo non è così diverso dalle altre due compagnie L unica variabile erano gli orari più comodi .
alucken49|aprile 2018|Doha|Sydney|Internazionali|Business|5.0|Esagerata|Una esperienza piacevolissima tutto nuovo ottimo servizio personale sia di terra che di bordo molto disponibile. Saletta in aeroporto eccezionale
palma56|NULL|Milano|Melbourne|Internazionali|Economy|4.0|Ottimo viaggio|Biglietto venduto come Alitalia, ma tutti i voli (milano-abu dhabi e abu dhabi-melbourne andata e ritorno) erano Ethad. Classe economy, ma spazio a sufficienza (1.78 altezza). Accettabile il cibo (si tratta pur sempre di una compagnia araba). Buona dotazione (coperta, cuffie, tappi orecchie, mascherina occhi, spazzolino e dentifricio). Ottimo intrattenimento: parecchi film (anche in italiano). Servizio molto buono. Aerei 777 e 787.
Ornelia N|febbraio 2019|Roma|Abu Dhabi|Internazionali|Economy|5.0|Piacevole sorpresa|È stato il mio primo volo con Etihad ed è stata una piacevole sorpresa. Aereo nuovo, volo puntuale, personale di bordo molto cortese, gallery film interessante.
ellegi71|gennaio 2019|Roma|Phuket|Internazionali|Economy|4.0|Volo da Roma a Phuket con scalo|Buona compagnia aerea , qualcuno parla italiano - pochi -, i sedili abbastanza comodi, anche se li ho trovati un tantino duri nella seduta, abbastanza larghi e spazio sufficiente con quello davanti. Intrattenimento sarebbe molto buono se fosse prevista anche la lingua italiana, ma quelle presenti nel sistema , solo arabo ed inglese , un po’ poco . Servizio gentile e disponibile, pranzo o cena buone ed anche la colazione. Volo puntuale e bagagli consegnati per tempo , nessuna complicazione. Nel complesso abbastanza buono
alessandra c|febbraio 2019|Roma|Abu Dhabi|Internazionali|Economy|4.0|Finalmente un volo decente|Abbiamo utilizzato questo volo prenotando una crociera Costa, ci siamo trovati molto bene, il cibo discreto, lo spazio vivibile tra i sedili leggermente superiore a quello degli altri voli similari. Anche a livello di pulizia (chiaramente quella valutabile dall'occhio umano) è sembrato soddisfacente.
fabrixsda|gennaio 2019|Roma|Bangkok|Internazionali|Economy|5.0|migliorata nei tempi e nell'organizzazione|Molto migliorata rispetto al passato. molto precisa e con attracchi direttamente ai gate senza interminabili spostamenti coi bus!
paolaT57|febbraio 2019|Roma|Tokyo|Internazionali|Economy|4.0|Scalo|salve ho un ora e 45 minuti per lo scalo ad Abu Dhabi, per poi proseguire per Tokyo. Volevo riassicurazioni sulle tempistiche, devo uscire e ripassare i controlli, devo compilare qualche foglio per il visto, anche se solo di passaggio? Ho paura che non conoscendo l'aeroporto e le modalità giuste perderò la coincidenza.
mauroPtorres|gennaio 2019|Abu Dhabi|Singapore|Internazionali|Economy|5.0|DA ROMA A ABU DHABI E FINO A SINGAPORE|Sicuramente un viaggio abbastanza lungo da Roma, 7 ore più sette ore fino all'aeroporto Changi di Singapore, ma come sempre abbastanza gradevole. Aereo molto spazioso, confortevole, con pasti serviti a tutte le ore, bibite e quant'altro si può richiedere a seconda della situazione in volo, personale gentilissimo e cortese. Valigie arrivate a destinazione assolutamente in orario e perfettamente integre, quindi per noi tutto è andato benissimo. Abbiamo in passato utilizzato spesso Emirates e Quantas per destinazione Sydney in Australia, ma questa è un'altra storia. Abbiamo viaggiato con Etihad a dicembre 2018 e gennaio 2019- ,
Mirna Fava|gennaio 2019|Milano|Malé|Internazionali|Economy|1.0|Una vera delusione !!!|Voliamo spesso con Emirates, ma questa volta per risparmiare 900€ (in 3 persone)abbiamo optato per Ethiad. Arriviamo a destinazione senza una valigia, la quale arriva 10 ore dopo con le mie cose all’interno (non vestiti) tutte sottosopra ,un disastro, mai successo !!! Per ben due volte in due tratte diverse finiscono il cibo , quindi ti danno quello che è rimasto (senza possibilità di scelta) ed in modo molto scortese, perché io preferivo il pollo al pesce perché non mi piace... Volo di rientro....aereo CONGELATO , un freezer !!! Quindi tosse e mal di gola... Ho chiesto se potevo prendere una copertina per mia figlia una volta scesi a Milano, con credo 0°, hanno risposto di NO sempre in modo scortese.... Sedili bruttini e stretti Siamo rimasti davvero DELUSI,mi dispiace !
ceci p|dicembre 2018|Bangkok|Abu Dhabi|Internazionali|Economy|4.0|cortesia eccezionale|ero stanchissima, ho chiesto ad una bellissima e giovane hostess di poter cambiare posto e trasferirmi nell'ultima fila centrale con ben 4 posti liberi perché avevo davvero bisogno di dormire sdraiandomi, rinunciando a pasti ed altri comforts. E' stata molto gentile e ha acconsentito subito (forse aveva visto che ero a pezzi) e sono riuscita a dormire 4 ore di filato. Deliziosamente svegliata dalla stessa che mi ha portato una super colazione. Ringrazio ancora adesso quella bellissima mora che mi ha fatto sentire amorevolmente accudita.
Salvus89|dicembre 2018|Bari|Singapore|Internazionali|Economy|1.0|Bagaglio danneggiato non rimborsato|Salve, vorrei raccontarvi la mia esperienza negativa con Ethiad. Premetto che sono un viaggiatore abituale ed ho viaggiato con diverse compagnie in giro per il mondo. A seguito del viaggio del 27 dicembre 2018, al mio arrivo a Singapore la mia valia risulta danneggiata. Segnalo la cosa al personale di aeroporto, che prontamente mi apre un claim. Seguo tutte le procedure e concludo la mia pratica on line sul sito Ethiad. Ora, dopo più di 1 mese, 10 email inviate e 15 chiamate effettuare all’ufficio Ethiad di Singapore, non ho ne ricevuto rimborso, ne valigia nuova e tantomeno una risposta! Una vera tristezza per questa compagnia, che sparisce e non comunica nulla dopo aver distrutto il mio bagaglio. Morale della favola, ho dovuto comprare un bagaglio a mie spese. Salvatore
floriana r|gennaio 2019|Roma|Melbourne|Internazionali|Economy|5.0|Soddisfatta|L'esperienza di volo è stata assolutamente positiva. I piloti sono stati molto bravi e il personale di bordo molto gentile. Ma il mio biglietto è stato acquistato come Alitalia e sarebbe gradita a bordo maggiore utilizzo della lingua italiana... Così come anche per l'intrattenimento poiché si trovano al massimo un paio di film in lingua italiana. Il giudizio rimane comunque positivo.
anna1800|gennaio 2019|Abu Dhabi|Roma|Internazionali|Economy|3.0|Buon servizio|Nonostante il volo fosse pieno il servizio è stato molto buono hostess cortesi e attente anche il cibo era passabile molto curato il benessere generale dei passeggeri
Michele|dicembre 2018|Roma|Victoria|Internazionali|Economy|3.0|problemi con i pasti speciali|Etihad non ha mai recepito la mia richiesta, dovuta a allergia certificata per avere pasti senza glutine, ma il personale di cabina, ha cercato di ovviare al problema, dimostrando una certa buona volontà. La segnalazione era stata fatta più volte avendone conferma, ma alla fine non ho mai avuto il mio pasto.
Matt|gennaio 2019|Sydney|Abu Dhabi|Internazionali|Economy|4.0|Bene ma manca qualcosa...|Valuterò a seconda degli aeromobili: A380 imbarco male organizzato, troppi pochi accessi per la cabina economy. A bordo lo spazio per le gambe è superiore alla media, intrattenimento di buon livello, lo schermo touch manca di qualche punto in sensibilità. Il cibo abbastanza vario e ben presentato, ma non hanno rispettato le segnalazioni fatte al momento dell’acquisto del biglietto, molto male. Aereo nuovo e ben tenuto, personale abbastanza presente e cortese, bagni sufficientemente numerosi. Mancherebbe qualche accorgimento per eguagliare Emirates e Qatar
